{
  "$schema": "https://json-schema.org/draft/2020-12/schema",
  "$id": "https://github.com/s-hiraoku/claude-harnesses/schemas/marketplace.schema.json",
  "title": "Claude Code plugin marketplace",
  "description": "Schema for .claude-plugin/marketplace.json.",
  "type": "object",
  "required": ["name", "owner", "plugins"],
  "additionalProperties": true,
  "properties": {
    "name": {
      "type": "string",
      "pattern": "^[a-z0-9][a-z0-9-]*[a-z0-9]$"
    },
    "description": { "type": "string" },
    "owner": {
      "type": "object",
      "required": ["name"],
      "properties": {
        "name": { "type": "string" },
        "url": { "type": "string", "format": "uri" }
      }
    },
    "plugins": {
      "type": "array",
      "minItems": 1,
      "items": {
        "type": "object",
        "required": ["name", "source", "description"],
        "properties": {
          "name": {
            "type": "string",
            "pattern": "^[a-z0-9][a-z0-9-]*[a-z0-9]$"
          },
          "source": { "type": "string" },
          "description": { "type": "string", "minLength": 10 },
          "version": { "type": "string" },
          "category": { "type": "string" },
          "tags": {
            "type": "array",
            "items": { "type": "string" }
          },
          "strict": { "type": "boolean" }
        }
      }
    }
  }
}
