{
  "name": "claude-harnesses",
  "owner": {
    "name": "s-hiraoku",
    "url": "https://github.com/s-hiraoku"
  },
  "description": "Curated hooks, skills, MCP recipes, and slash commands for long-running, safe, high-quality Claude Code-driven development.",
  "plugins": [
    {
      "name": "adviser-pack",
      "source": "./plugins/adviser-pack",
      "description": "Fallback Adviser consultations using a read-only Opus subagent when the native Advisor tool is unavailable.",
      "category": "workflow",
      "tags": ["adviser", "advisor", "review", "fallback"]
    },
    {
      "name": "review-pack",
      "source": "./plugins/review-pack",
      "description": "Severity-ranked code review and multi-pass security review with parallel specialist subagents.",
      "category": "review",
      "tags": ["code-review", "security-review"]
    },
    {
      "name": "pr-guardian-pack",
      "source": "./plugins/pr-guardian-pack",
      "description": "Watch PRs after creation: monitor CI, dispatch fixes via subagents, address review feedback.",
      "category": "ci",
      "tags": ["pr", "ci", "automation"]
    },
    {
      "name": "tdd-pack",
      "source": "./plugins/tdd-pack",
      "description": "Red-Green-Refactor TDD with subagent context isolation between phases.",
      "category": "testing",
      "tags": ["tdd", "testing"]
    },
    {
      "name": "safety-pack",
      "source": "./plugins/safety-pack",
      "description": "Deterministic PreToolUse guards: secret detection, dangerous commands, branch protection, prompt injection, MCP allowlisting.",
      "category": "safety",
      "tags": ["security", "hooks", "guardrails"]
    },
    {
      "name": "verification-pack",
      "source": "./plugins/verification-pack",
      "description": "Verification feedback loop: format/typecheck/test on every edit, and block premature Stop until verify.sh passes.",
      "category": "verification",
      "tags": ["tests", "hooks", "verification"]
    },
    {
      "name": "long-running-pack",
      "source": "./plugins/long-running-pack",
      "description": "Survive context loss across sessions: SessionStart context injection, cost-ceiling guard, large-edit gate, ledger templates, goal-manager workflow.",
      "category": "long-running",
      "tags": ["ledger", "checkpoint", "cost", "long-running"]
    },
    {
      "name": "mcp-pack",
      "source": "./plugins/mcp-pack",
      "description": "Curated .mcp.json recipe for GitHub, Playwright, Context7, Serena, Sequential-Thinking, Sentry, and Excalidraw. All servers ship disabled.",
      "category": "mcp",
      "tags": ["mcp", "github", "playwright", "context7", "serena", "excalidraw"]
    },
    {
      "name": "product-pack",
      "source": "./plugins/product-pack",
      "description": "Product-quality workflows for frontend design, image-guided UI direction, kaizen evaluation loops, and merge-ready implementation delivery.",
      "category": "product",
      "tags": ["product", "frontend", "ui", "delivery", "kaizen"]
    },
    {
      "name": "research-pack",
      "source": "./plugins/research-pack",
      "description": "Research helpers for reading public web pages that normal browsing, scraping, snippets, or direct fetch tools cannot read cleanly.",
      "category": "research",
      "tags": ["research", "jina", "reader", "web"]
    },
    {
      "name": "meta-pack",
      "source": "./plugins/meta-pack",
      "description": "Inspect recent Claude Code activity and promote repeated patterns into the smallest useful Skill, subagent, or hook. Read-only investigation; creation gated by user approval.",
      "category": "meta",
      "tags": ["meta", "skill-creation", "patterns"]
    },
    {
      "name": "teaching-pack",
      "source": "./plugins/teaching-pack",
      "description": "Teach the human everything that happened in a session until they can demonstrably explain it, via an incremental checklist and AskUserQuestion quizzes.",
      "category": "teaching",
      "tags": ["teaching", "learning", "onboarding"]
    },
    {
      "name": "full",
      "source": "./plugins/full",
      "description": "Umbrella plugin pulling in every functional pack at once.",
      "category": "umbrella",
      "tags": ["full", "umbrella"]
    }
  ]
}
